{"$id":"urn:aevum:schema:timechain.block.v1","$schema":"https://json-schema.org/draft/2020-12/schema","additionalProperties":false,"properties":{"event_digest":{"$ref":"urn:aevum:schema:aevum.common.v1#/$defs/sha256"},"event_hashes":{"items":{"$ref":"urn:aevum:schema:aevum.common.v1#/$defs/sha256"},"type":"array"},"height":{"minimum":0,"type":"integer"},"kind":{"const":"timechain.block.v1"},"prev_block_hash":{"$ref":"urn:aevum:schema:aevum.common.v1#/$defs/sha256"},"v":{"const":1},"window":{"additionalProperties":false,"properties":{"duration_ns":{"maximum":60000000000,"minimum":1,"type":"integer"},"start_ns":{"$ref":"urn:aevum:schema:aevum.common.v1#/$defs/u64_ns"}},"required":["start_ns","duration_ns"],"type":"object"}},"required":["kind","v","height","window","prev_block_hash","event_hashes","event_digest"],"title":"TimeChain Block v1","type":"object"}
