{"event_digest":"sha256:89b35837b6dc13ab74ad58b6732c407695de33c5f5abbb3dab5d498a1cf76cc7","event_hashes":["sha256:24ba1042154cdb00b51bda2d78d0f90385290e95161cb42b216893d4b3b19b75"],"height":0,"kind":"timechain.block.v1","prev_block_hash":"sha256:0000000000000000000000000000000000000000000000000000000000000000","v":1,"window":{"duration_ns":1000000000,"start_ns":1700000000000000000}}
